<!DOCTYPE aspectwerkz PUBLIC "-//AspectWerkz//DTD//EN" "http://aspectwerkz.codehaus.org/dtd/aspectwerkz2.dtd">
<aspectwerkz>
    <system id="awbench">
        <aspect class="awbench.extension.aopalliance.MethodExecutionAroundSJPAdvice">
            <advice name="invoke" type="around" bind-to="execution(* awbench.method.Execution.aroundSJP())"/>
        </aspect>
        <aspect class="awbench.extension.aopalliance.MethodExecutionAroundJPAdvice">
            <advice name="invoke" type="around" bind-to="execution(* awbench.method.Execution.aroundJP())"/>
        </aspect>
        <aspect name="around1" class="awbench.extension.aopalliance.MethodExecutionGetTargetAndArgsAroundAdvice">
            <advice name="invoke" type="around" bind-to="execution(* awbench.method.Execution.aroundStackedWithArgAndTarget(int))"/>
        </aspect>
        <aspect name="around2" class="awbench.extension.aopalliance.MethodExecutionGetTargetAndArgsAroundAdvice">
            <advice name="invoke" type="around" bind-to="execution(* awbench.method.Execution.aroundStackedWithArgAndTarget(int))"/>
        </aspect>
    </system>
</aspectwerkz>
